ID;Image;Nom;test;R??ence;Categorie;Fournisseur;Prix HT;ID Taxe;Etat
60;http://pprod.koomaakiti.com/img/p/60/60-a.jpg;Cerelac riz Nestlé - Boite de 400g;Dès l'âge de 6 mois, aliment de sevrage à haute valeur nutritive et facile à digérer. Contient des protéines, du lait de haute qualité, ainsi que toutes les vitamines et sels minéraux jouant un rôle important dans la croissance de l'enfant.;e-cer-ne-400;Bébé*Produits laitiers;Alpha;37000;65;1
61;http://pprod.koomaakiti.com/img/p/61/61-a.jpg;Cerelac fruit Nestlé - Boite de 400g;Dès l'âge de 6 mois, aliment de sevrage à haute valeur nutritive et facile à digérer. Contient des protéines, du lait de haute qualité, ainsi que toutes les vitamines et sels minéraux jouant un rôle important dans la croissance de l’enfant.;e-cer-ne-400;Bébé*Produits laitiers;Alpha;42000;65;1
62;http://pprod.koomaakiti.com/img/p/62/62-a.jpg;Café en poudre Nescafé - Sachet de 100g;Café instantané pour une quantité nette de 100 grammes. Café corsé et intense idéal pour bien commencer la journée.;l-caf-ne-100;Epicerie sucrée*Boissons;Alpha;15000;65;1
63;http://pprod.koomaakiti.com/img/p/63/63-a.jpg;Lait en poudre Pura - Sachet de 20g;Fabriqué à base de lait frais entier pasteurisé et séché par atomisation. Il est composé de tous les constituants du lait frais et fournit les mêmes saveurs.;l-lai-pu-20;Boissons*Produits laitiers;Alpha;1000;65;1
64;http://pprod.koomaakiti.com/img/p/64/64-a.jpg;Cerelac céréale Nestlé - Boite de 400g;Dès l'âge de 6 mois, aliment de sevrage à haute valeur nutritive et facile à digérer. Contient des protéines, du lait de haute qualité, ainsi que toutes les vitamines et sels minéraux jouant un rôle important dans la croissance de l’enfant.;e-cer-ne-400;Bébé*Produits laitiers;Alpha;32000;65;1
